{
  "meta": {
    "competition": "FIFA World Cup 2026",
    "tzOffset": -6,
    "lastUpdated": "2026-06-26T18:00:00Z",
    "note": "Seed data. officialScore/officialFinal are human-confirmed truth. Group G/H/L finales pending."
  },
  "teams": [
    {
      "code": "MEX",
      "name": "Mexico",
      "cn": "墨西哥",
      "flag": "🇲🇽",
      "group": "A"
    },
    {
      "code": "RSA",
      "name": "South Africa",
      "cn": "南非",
      "flag": "🇿🇦",
      "group": "A"
    },
    {
      "code": "KOR",
      "name": "South Korea",
      "cn": "韩国",
      "flag": "🇰🇷",
      "group": "A"
    },
    {
      "code": "CZE",
      "name": "Czechia",
      "cn": "捷克",
      "flag": "🇨🇿",
      "group": "A"
    },
    {
      "code": "SUI",
      "name": "Switzerland",
      "cn": "瑞士",
      "flag": "🇨🇭",
      "group": "B"
    },
    {
      "code": "CAN",
      "name": "Canada",
      "cn": "加拿大",
      "flag": "🇨🇦",
      "group": "B"
    },
    {
      "code": "BIH",
      "name": "Bosnia and Herzegovina",
      "cn": "波黑",
      "flag": "🇧🇦",
      "group": "B"
    },
    {
      "code": "QAT",
      "name": "Qatar",
      "cn": "卡塔尔",
      "flag": "🇶🇦",
      "group": "B"
    },
    {
      "code": "BRA",
      "name": "Brazil",
      "cn": "巴西",
      "flag": "🇧🇷",
      "group": "C"
    },
    {
      "code": "MAR",
      "name": "Morocco",
      "cn": "摩洛哥",
      "flag": "🇲🇦",
      "group": "C"
    },
    {
      "code": "SCO",
      "name": "Scotland",
      "cn": "苏格兰",
      "flag": "🏴",
      "group": "C"
    },
    {
      "code": "HAI",
      "name": "Haiti",
      "cn": "海地",
      "flag": "🇭🇹",
      "group": "C"
    },
    {
      "code": "USA",
      "name": "USA",
      "cn": "美国",
      "flag": "🇺🇸",
      "group": "D"
    },
    {
      "code": "AUS",
      "name": "Australia",
      "cn": "澳大利亚",
      "flag": "🇦🇺",
      "group": "D"
    },
    {
      "code": "PAR",
      "name": "Paraguay",
      "cn": "巴拉圭",
      "flag": "🇵🇾",
      "group": "D"
    },
    {
      "code": "TUR",
      "name": "Turkiye",
      "cn": "土耳其",
      "flag": "🇹🇷",
      "group": "D"
    },
    {
      "code": "GER",
      "name": "Germany",
      "cn": "德国",
      "flag": "🇩🇪",
      "group": "E"
    },
    {
      "code": "CIV",
      "name": "Ivory Coast",
      "cn": "科特迪瓦",
      "flag": "🇨🇮",
      "group": "E"
    },
    {
      "code": "ECU",
      "name": "Ecuador",
      "cn": "厄瓜多尔",
      "flag": "🇪🇨",
      "group": "E"
    },
    {
      "code": "CUW",
      "name": "Curacao",
      "cn": "库拉索",
      "flag": "🇨🇼",
      "group": "E"
    },
    {
      "code": "NED",
      "name": "Netherlands",
      "cn": "荷兰",
      "flag": "🇳🇱",
      "group": "F"
    },
    {
      "code": "JPN",
      "name": "Japan",
      "cn": "日本",
      "flag": "🇯🇵",
      "group": "F"
    },
    {
      "code": "SWE",
      "name": "Sweden",
      "cn": "瑞典",
      "flag": "🇸🇪",
      "group": "F"
    },
    {
      "code": "TUN",
      "name": "Tunisia",
      "cn": "突尼斯",
      "flag": "🇹🇳",
      "group": "F"
    },
    {
      "code": "EGY",
      "name": "Egypt",
      "cn": "埃及",
      "flag": "🇪🇬",
      "group": "G"
    },
    {
      "code": "IRN",
      "name": "Iran",
      "cn": "伊朗",
      "flag": "🇮🇷",
      "group": "G"
    },
    {
      "code": "BEL",
      "name": "Belgium",
      "cn": "比利时",
      "flag": "🇧🇪",
      "group": "G"
    },
    {
      "code": "NZL",
      "name": "New Zealand",
      "cn": "新西兰",
      "flag": "🇳🇿",
      "group": "G"
    },
    {
      "code": "ESP",
      "name": "Spain",
      "cn": "西班牙",
      "flag": "🇪🇸",
      "group": "H"
    },
    {
      "code": "URU",
      "name": "Uruguay",
      "cn": "乌拉圭",
      "flag": "🇺🇾",
      "group": "H"
    },
    {
      "code": "CPV",
      "name": "Cape Verde",
      "cn": "佛得角",
      "flag": "🇨🇻",
      "group": "H"
    },
    {
      "code": "KSA",
      "name": "Saudi Arabia",
      "cn": "沙特",
      "flag": "🇸🇦",
      "group": "H"
    },
    {
      "code": "FRA",
      "name": "France",
      "cn": "法国",
      "flag": "🇫🇷",
      "group": "I"
    },
    {
      "code": "NOR",
      "name": "Norway",
      "cn": "挪威",
      "flag": "🇳🇴",
      "group": "I"
    },
    {
      "code": "SEN",
      "name": "Senegal",
      "cn": "塞内加尔",
      "flag": "🇸🇳",
      "group": "I"
    },
    {
      "code": "IRQ",
      "name": "Iraq",
      "cn": "伊拉克",
      "flag": "🇮🇶",
      "group": "I"
    },
    {
      "code": "ARG",
      "name": "Argentina",
      "cn": "阿根廷",
      "flag": "🇦🇷",
      "group": "J"
    },
    {
      "code": "AUT",
      "name": "Austria",
      "cn": "奥地利",
      "flag": "🇦🇹",
      "group": "J"
    },
    {
      "code": "ALG",
      "name": "Algeria",
      "cn": "阿尔及利亚",
      "flag": "🇩🇿",
      "group": "J"
    },
    {
      "code": "JOR",
      "name": "Jordan",
      "cn": "约旦",
      "flag": "🇯🇴",
      "group": "J"
    },
    {
      "code": "COL",
      "name": "Colombia",
      "cn": "哥伦比亚",
      "flag": "🇨🇴",
      "group": "K"
    },
    {
      "code": "POR",
      "name": "Portugal",
      "cn": "葡萄牙",
      "flag": "🇵🇹",
      "group": "K"
    },
    {
      "code": "COD",
      "name": "DR Congo",
      "cn": "刚果(金)",
      "flag": "🇨🇩",
      "group": "K"
    },
    {
      "code": "UZB",
      "name": "Uzbekistan",
      "cn": "乌兹别克",
      "flag": "🇺🇿",
      "group": "K"
    },
    {
      "code": "ENG",
      "name": "England",
      "cn": "英格兰",
      "flag": "🏴",
      "group": "L"
    },
    {
      "code": "GHA",
      "name": "Ghana",
      "cn": "加纳",
      "flag": "🇬🇭",
      "group": "L"
    },
    {
      "code": "CRO",
      "name": "Croatia",
      "cn": "克罗地亚",
      "flag": "🇭🇷",
      "group": "L"
    },
    {
      "code": "PAN",
      "name": "Panama",
      "cn": "巴拿马",
      "flag": "🇵🇦",
      "group": "L"
    }
  ],
  "groups": {
    "A": [
      "MEX",
      "RSA",
      "KOR",
      "CZE"
    ],
    "B": [
      "SUI",
      "CAN",
      "BIH",
      "QAT"
    ],
    "C": [
      "BRA",
      "MAR",
      "SCO",
      "HAI"
    ],
    "D": [
      "USA",
      "AUS",
      "PAR",
      "TUR"
    ],
    "E": [
      "GER",
      "CIV",
      "ECU",
      "CUW"
    ],
    "F": [
      "NED",
      "JPN",
      "SWE",
      "TUN"
    ],
    "G": [
      "EGY",
      "IRN",
      "BEL",
      "NZL"
    ],
    "H": [
      "ESP",
      "URU",
      "CPV",
      "KSA"
    ],
    "I": [
      "FRA",
      "NOR",
      "SEN",
      "IRQ"
    ],
    "J": [
      "ARG",
      "AUT",
      "ALG",
      "JOR"
    ],
    "K": [
      "COL",
      "POR",
      "COD",
      "UZB"
    ],
    "L": [
      "ENG",
      "GHA",
      "CRO",
      "PAN"
    ]
  },
  "matches": [
    {
      "id": "M001",
      "stage": "group",
      "round": "小组赛 第1轮",
      "group": "A",
      "kickoffUtc": "2026-06-11T19:00:00Z",
      "venue": "Estadio Azteca",
      "city": "Mexico City",
      "home": "MEX",
      "away": "RSA",
      "apiScore": [
        2,
        1
      ],
      "apiStatus": "FT",
      "officialScore": [
        2,
        1
      ],
      "officialFinal": true,
      "scorers": []
    },
    {
      "id": "M072",
      "stage": "group",
      "round": "小组赛 第3轮",
      "group": "B",
      "kickoffUtc": "2026-06-22T18:00:00Z",
      "venue": "MetLife",
      "city": "NY/NJ",
      "home": "BIH",
      "away": "CAN",
      "apiScore": [
        1,
        2
      ],
      "apiStatus": "FT",
      "officialScore": [
        1,
        2
      ],
      "officialFinal": true,
      "scorers": []
    },
    {
      "id": "M071",
      "stage": "group",
      "round": "小组赛 第3轮",
      "group": "B",
      "kickoffUtc": "2026-06-22T18:00:00Z",
      "venue": "MetLife",
      "city": "NY/NJ",
      "home": "SUI",
      "away": "QAT",
      "apiScore": [
        3,
        1
      ],
      "apiStatus": "FT",
      "officialScore": [
        3,
        1
      ],
      "officialFinal": true,
      "scorers": []
    },
    {
      "id": "M070",
      "stage": "group",
      "round": "小组赛 第3轮",
      "group": "A",
      "kickoffUtc": "2026-06-22T22:00:00Z",
      "venue": "Estadio Azteca",
      "city": "Mexico City",
      "home": "MEX",
      "away": "CZE",
      "apiScore": [
        3,
        0
      ],
      "apiStatus": "FT",
      "officialScore": [
        3,
        0
      ],
      "officialFinal": true,
      "scorers": []
    },
    {
      "id": "M069",
      "stage": "group",
      "round": "小组赛 第3轮",
      "group": "A",
      "kickoffUtc": "2026-06-22T22:00:00Z",
      "venue": "Akron",
      "city": "Guadalajara",
      "home": "KOR",
      "away": "RSA",
      "apiScore": [
        1,
        0
      ],
      "apiStatus": "FT",
      "officialScore": [
        1,
        0
      ],
      "officialFinal": true,
      "scorers": []
    },
    {
      "id": "M068",
      "stage": "group",
      "round": "小组赛 第3轮",
      "group": "D",
      "kickoffUtc": "2026-06-23T18:00:00Z",
      "venue": "Lumen",
      "city": "Seattle",
      "home": "USA",
      "away": "TUR",
      "apiScore": [
        2,
        1
      ],
      "apiStatus": "FT",
      "officialScore": [
        2,
        1
      ],
      "officialFinal": true,
      "scorers": []
    },
    {
      "id": "M067",
      "stage": "group",
      "round": "小组赛 第3轮",
      "group": "D",
      "kickoffUtc": "2026-06-23T18:00:00Z",
      "venue": "Levi's",
      "city": "SF",
      "home": "PAR",
      "away": "AUS",
      "apiScore": [
        1,
        1
      ],
      "apiStatus": "FT",
      "officialScore": [
        1,
        1
      ],
      "officialFinal": true,
      "scorers": []
    },
    {
      "id": "M066",
      "stage": "group",
      "round": "小组赛 第3轮",
      "group": "C",
      "kickoffUtc": "2026-06-23T22:00:00Z",
      "venue": "SoFi",
      "city": "LA",
      "home": "BRA",
      "away": "HAI",
      "apiScore": [
        4,
        0
      ],
      "apiStatus": "FT",